"","text","favorited","favoriteCount","replyToSN","created","truncated","replyToSID","id","replyToUID","statusSource","screenName","retweetCount","isRetweet","retweeted","longitude","latitude"
"327","Day 67 of my 365 solo play challenge. I am finally feeling better after three straight days of being knocked on my… https://t.co/nHoxMPBTax",FALSE,0,NA,2019-03-08 18:30:22,TRUE,NA,"1104086973294075904",NA,"<a href=""http://instagram.com"" rel=""nofollow"">Instagram</a>","realtriviageek",0,FALSE,FALSE,NA,NA
"328","@marabutler67 I know, Sweden is preparing for an Ebola outbreak, who ever heard of Ebola in Sweden before? And ther… https://t.co/1sYwf6Qs8c",FALSE,1,"marabutler67",2019-03-08 18:30:15,TRUE,"1104061361640931328","1104086945221799937","714073533270401024","<a href=""http://twitter.com/download/android"" rel=""nofollow"">Twitter for Android</a>","Waybeyondempty2",1,FALSE,FALSE,NA,NA
"329","Flu season may not have peaked, and there's another wave of severe infections underway, CDC says - CNN https://t.co/3t25V68zdv",FALSE,0,NA,2019-03-08 18:30:05,FALSE,NA,"1104086904746708992",NA,"<a href=""http://twitter.com/download/iphone"" rel=""nofollow"">Twitter for iPhone</a>","VictorDiaz302",0,FALSE,FALSE,NA,NA
"330","Another Wave of Severe Flu Infections Strikes: CDC https://t.co/RAuevhyi5S https://t.co/RtSLxIk62U",FALSE,0,NA,2019-03-08 18:29:30,FALSE,NA,"1104086758424236032",NA,"<a href=""http://publicize.wp.com/"" rel=""nofollow"">WordPress.com</a>","buzzzbry",0,FALSE,FALSE,NA,NA
"331","@bmbritton32 thank u! i’m pretty sure i have the flu so i had to go home",FALSE,0,"bmbritton32",2019-03-08 18:28:32,FALSE,"1104052239071629312","1104086514223538176","2987072534","<a href=""http://twitter.com/download/iphone"" rel=""nofollow"">Twitter for iPhone</a>","_thttallgirl_",0,FALSE,FALSE,NA,NA
"332","@loconti38 girl I feel <U+0001F62D> I've been down with the stomach flu for the last 3 days. Hope you feel better soon",FALSE,0,"loconti38",2019-03-08 18:27:32,FALSE,"1104026796826259456","1104086260258349060","816494708","<a href=""http://twitter.com/download/android"" rel=""nofollow"">Twitter for Android</a>","mirsey_xoxo",0,FALSE,FALSE,NA,NA
"333","The Flu season is far from over  https://t.co/8PVdloC33W",FALSE,0,NA,2019-03-08 18:27:20,FALSE,NA,"1104086213776961536",NA,"<a href=""http://twitter.com/download/iphone"" rel=""nofollow"">Twitter for iPhone</a>","Msmere7Parker",0,FALSE,FALSE,NA,NA
"334","On a more positive note, I feel great today. Not exhausted from the flu. The sun is out. Spent some time outside. https://t.co/yRLZgmF9s2",FALSE,1,NA,2019-03-08 18:27:18,FALSE,NA,"1104086204121788416",NA,"<a href=""https://about.twitter.com/products/tweetdeck"" rel=""nofollow"">TweetDeck</a>","beam_tyrant",0,FALSE,FALSE,NA,NA
"335","An average of more than 70 students have been absent from school because of illness, the letter states. https://t.co/If8zkC8abX",FALSE,0,NA,2019-03-08 18:27:03,FALSE,NA,"1104086139617583106",NA,"<a href=""http://www.socialnewsdesk.com"" rel=""nofollow"">SocialNewsDesk</a>","ydrcom",0,FALSE,FALSE,NA,NA
"336","Don't know whether you have a cold or the flu? We break down the difference. https://t.co/s2EC6BGq0u",FALSE,2,NA,2019-03-08 18:27:00,FALSE,NA,"1104086127340933120",NA,"<a href=""https://studio.twitter.com"" rel=""nofollow"">Twitter Media Studio</a>","medicaldaily",1,FALSE,FALSE,NA,NA
"337","Unboxing The #BoxyPets! Lulu, Buttons, Stripes, Violet, Yummies, And Flu... https://t.co/xdzrTOsBoi via @YouTube",FALSE,0,NA,2019-03-08 18:26:57,FALSE,NA,"1104086116779610113",NA,"<a href=""http://twitter.com"" rel=""nofollow"">Twitter Web Client</a>","SparklewithDani",0,FALSE,FALSE,NA,NA
"338","@JupiterDi1112 Yep. We lost a neighbor to the flu last year.",FALSE,1,"JupiterDi1112",2019-03-08 18:26:53,FALSE,"1104085689623166977","1104086098316353536","954371557","<a href=""http://twitter.com/download/iphone"" rel=""nofollow"">Twitter for iPhone</a>","screaminggina",0,FALSE,FALSE,NA,NA
"339","The medical term for what I just coughed up is a ""Kuato"". #flu",FALSE,0,NA,2019-03-08 18:26:46,FALSE,NA,"1104086069711118337",NA,"<a href=""http://twitter.com/download/iphone"" rel=""nofollow"">Twitter for iPhone</a>","MikeMercadal",0,FALSE,FALSE,NA,NA
"340","blessed i got the flu before spring break cause i lost 5 lbs and have rock hard abs from all the coughing",FALSE,2,NA,2019-03-08 18:26:43,FALSE,NA,"1104086057493123072",NA,"<a href=""http://twitter.com/download/android"" rel=""nofollow"">Twitter for Android</a>","tash274",0,FALSE,FALSE,NA,NA
"341","I hate this winter! I've had the flu three times and this time I've lost my voice, and my kids are like AREN'T YOU… https://t.co/zBX7RMwkHU",FALSE,0,NA,2019-03-08 18:26:18,TRUE,NA,"1104085949938458624",NA,"<a href=""http://www.facebook.com/twitter"" rel=""nofollow"">Facebook</a>","humeirakazmi",0,FALSE,FALSE,NA,NA
"342","i swear working in an office during cold/flu season is like going to the doctor and asking every single person ther… https://t.co/QvRBzKyGYu",FALSE,3,NA,2019-03-08 18:26:14,TRUE,NA,"1104085933131874304",NA,"<a href=""http://twitter.com"" rel=""nofollow"">Twitter Web Client</a>","alyssarbrts",1,FALSE,FALSE,NA,NA
"343","Flu season may not have peaked, and there's another wave of severe infections underway, CDC says - CNN https://t.co/aarbRwG0RM",FALSE,1,NA,2019-03-08 18:26:02,FALSE,NA,"1104085886331957249",NA,"<a href=""http://twitter.com/download/iphone"" rel=""nofollow"">Twitter for iPhone</a>","liartelocin",0,FALSE,FALSE,NA,NA
"344","Flu season may not have peaked, and there's another wave of severe infections underway, CDC says - CNN https://t.co/w79jrws6kR",FALSE,0,NA,2019-03-08 18:25:27,FALSE,NA,"1104085737488744455",NA,"<a href=""http://twitter.com/download/iphone"" rel=""nofollow"">Twitter for iPhone</a>","law_4thepeople",0,FALSE,FALSE,NA,NA
"345","@VonteWrld @zFluWorld @leanhilfiger @Nxscarr @LucciTooReal Flu you the bro and you know that i just ain’t Hear from… https://t.co/cX6J2HCWED",FALSE,0,"VonteWrld",2019-03-08 18:25:14,TRUE,"1104082778944081923","1104085685269643264","810220303800553473","<a href=""http://twitter.com/download/iphone"" rel=""nofollow"">Twitter for iPhone</a>","TylerSoo_",0,FALSE,FALSE,NA,NA
"346","Cool new study in @mbiojounral using network analysis to discover new host factors important for influenza virus re… https://t.co/IWchGMbEuB",FALSE,0,NA,2019-03-08 18:25:10,TRUE,NA,"1104085667599056901",NA,"<a href=""http://twuffer.com"" rel=""nofollow"">Twuffer</a>","nickwohlge",0,FALSE,FALSE,NA,NA
"347","#DYK: There are positive side effects, like how the #flushot can benefit your heart. Learn more here: https://t.co/W2v5HcMxDo @USNewsHealth",FALSE,0,NA,2019-03-08 18:25:09,FALSE,NA,"1104085663832596481",NA,"<a href=""https://www.hootsuite.com"" rel=""nofollow"">Hootsuite Inc.</a>","MontefioreNYC",0,FALSE,FALSE,NA,NA
"348","Choosing Antibiotics Wisely: What patients need to know when talking about cold-and-flu season with their doctor: https://t.co/BwPV3bGFaq",FALSE,0,NA,2019-03-08 18:25:06,FALSE,NA,"1104085650029068288",NA,"<a href=""https://www.hootsuite.com"" rel=""nofollow"">Hootsuite Inc.</a>","cpso_ca",0,FALSE,FALSE,NA,NA
"349","Nine children died of flu-related causes last week https://t.co/i1tDlIBlDJ",FALSE,10,NA,2019-03-08 18:23:59,FALSE,NA,"1104085366766792705",NA,"<a href=""http://www.socialflow.com"" rel=""nofollow"">SocialFlow</a>","thedailybeast",18,FALSE,FALSE,NA,NA
"350","Flu season may not have peaked, and there's another wave of severe infections underway, CDC says - CNN https://t.co/2xupCL8CvT",FALSE,0,NA,2019-03-08 18:23:52,FALSE,NA,"1104085340950802432",NA,"<a href=""http://twitter.com/download/iphone"" rel=""nofollow"">Twitter for iPhone</a>","virtuewomenllc",0,FALSE,FALSE,NA,NA
"351","i just got uber eats popeyes and i have the flu AND bronchitis,,, how are y’all <U+0001F970>",FALSE,0,NA,2019-03-08 18:23:14,FALSE,NA,"1104085182108364800",NA,"<a href=""http://twitter.com/download/iphone"" rel=""nofollow"">Twitter for iPhone</a>","everydayhoseoki",0,FALSE,FALSE,NA,NA
"352","@swiftserpens Sounds like you could maybe have the bronchitis <U+0001F9D0> I had what I thought was the flu with a disgusting… https://t.co/FHxRD4okvl",FALSE,1,"swiftserpens",2019-03-08 18:23:02,TRUE,"1104084074203770880","1104085128664342528","2580183200","<a href=""http://twitter.com/download/iphone"" rel=""nofollow"">Twitter for iPhone</a>","soupswift",0,FALSE,FALSE,NA,NA
"353","@DrPChouinard If you don’t believe in getting your flu shot, you don’t belong in healthcare",FALSE,1,"DrPChouinard",2019-03-08 18:22:30,FALSE,"1104052858272526336","1104084997512802305","1126859785","<a href=""http://twitter.com/download/iphone"" rel=""nofollow"">Twitter for iPhone</a>","TheKidKidDoc",0,FALSE,FALSE,NA,NA
"354","There's a second wave of severe flu infections happening, CDC says. https://t.co/l2fuz24lDs",FALSE,0,NA,2019-03-08 18:22:28,FALSE,NA,"1104084985189851136",NA,"<a href=""http://twitter.com/NewsNevada"" rel=""nofollow"">Nevada News</a>","Nevada",0,FALSE,FALSE,NA,NA
"355","People who get on planes with obvious colds/coughs/flu/death rattles and don’t wear a mask are the worst kind of se… https://t.co/BFPmsFoKHR",FALSE,16,NA,2019-03-08 18:22:25,TRUE,NA,"1104084975308230656",NA,"<a href=""https://mobile.twitter.com"" rel=""nofollow"">Twitter Web App</a>","rox_anne_b",2,FALSE,FALSE,NA,NA
"356","I’m getting a flu before I have a concert like why me ?",FALSE,1,NA,2019-03-08 18:22:23,FALSE,NA,"1104084968056283136",NA,"<a href=""http://twitter.com/download/iphone"" rel=""nofollow"">Twitter for iPhone</a>","loyauhlbieber_",0,FALSE,FALSE,NA,NA
"357","I went all flu/cold season without catching anything while working with sick babies/kids and now I have a touch of… https://t.co/gDvF99zceS",FALSE,0,NA,2019-03-08 18:22:08,TRUE,NA,"1104084903262674944",NA,"<a href=""http://twitter.com/download/iphone"" rel=""nofollow"">Twitter for iPhone</a>","hgrayyyy",0,FALSE,FALSE,NA,NA
"358","Get vaccinated, folks. Flu season may not have peaked, and there's another wave of severe infections underway, CDC… https://t.co/YWRpypq7je",FALSE,4,NA,2019-03-08 18:21:57,TRUE,NA,"1104084859167956992",NA,"<a href=""http://twitter.com/download/iphone"" rel=""nofollow"">Twitter for iPhone</a>","screaminggina",1,FALSE,FALSE,NA,NA
"359","@DoodleNessa Daughter has flu. Ugh",FALSE,1,"DoodleNessa",2019-03-08 18:21:44,FALSE,"1103979945511043073","1104084802859343872","3390802061","<a href=""http://twitter.com/download/android"" rel=""nofollow"">Twitter for Android</a>","AshleyL34710768",0,FALSE,FALSE,NA,NA
"360","Flu season may not have peaked, and there's another wave of severe infections underway, CDC says - CNN https://t.co/T2YW8YytWo",FALSE,0,NA,2019-03-08 18:20:59,FALSE,NA,"1104084612094091265",NA,"<a href=""http://twitter.com/download/iphone"" rel=""nofollow"">Twitter for iPhone</a>","fxp123",1,FALSE,FALSE,NA,NA
"361","The flu sucks so far I’ve watched every Nicolette gray YouTube video, the notebook, all three John mulaney specials… https://t.co/17Q8H5YETK",FALSE,3,NA,2019-03-08 18:20:39,TRUE,NA,"1104084530850418693",NA,"<a href=""http://twitter.com/download/iphone"" rel=""nofollow"">Twitter for iPhone</a>","MelanieGibson13",0,FALSE,FALSE,NA,NA
"362","Flu-like illness in flu-ravaged #Nebraska eased below the high level for first time in 11 weeks during week ended M… https://t.co/NdB7CLqnkR",FALSE,0,NA,2019-03-08 18:20:36,TRUE,NA,"1104084518925938689",NA,"<a href=""http://twitter.com"" rel=""nofollow"">Twitter Web Client</a>","HHSRegion7",1,FALSE,FALSE,NA,NA
"363","Flu season may not have peaked, and there's another wave of severe infections underway, CDC says - CNN https://t.co/RCfixX4n87",FALSE,0,NA,2019-03-08 18:20:21,FALSE,NA,"1104084454627131397",NA,"<a href=""http://twitter.com/#!/download/ipad"" rel=""nofollow"">Twitter for iPad</a>","ohara_dustin",0,FALSE,FALSE,NA,NA
"364","Flu season may not have peaked, and there's another wave of severe infections underway, CDC says - CNN https://t.co/5uEjLCGNQy",FALSE,0,NA,2019-03-08 18:20:20,FALSE,NA,"1104084452286828546",NA,"<a href=""http://twitter.com/download/iphone"" rel=""nofollow"">Twitter for iPhone</a>","saintsinna5",0,FALSE,FALSE,NA,NA
"365","CDC flu report: 8 more children have died. https://t.co/eLjKGpfX4l  #FightFlu #VaccinesWork https://t.co/C6mKlmrJsk",FALSE,0,NA,2019-03-08 18:20:06,FALSE,NA,"1104084391498838016",NA,"<a href=""https://www.hootsuite.com"" rel=""nofollow"">Hootsuite Inc.</a>","AAPNews",0,FALSE,FALSE,NA,NA
"366","@Neil_McNeil Today is my Tuesday and I am coming down with the flu.",FALSE,0,"Neil_McNeil",2019-03-08 18:18:49,FALSE,"1104083742342017024","1104084069795672065","25399451","<a href=""http://twitter.com"" rel=""nofollow"">Twitter Web Client</a>","TJMWestfield",0,FALSE,FALSE,NA,NA
"367","@PublicHealthUMN @amyklobuchar @SenMarkey @SenTinaSmith You know what kills me? (Other than a lot of things) is tha… https://t.co/zU3ZJDNk5u",FALSE,1,"PublicHealthUMN",2019-03-08 18:17:59,TRUE,"1104081036965789696","1104083858675458049","14619361","<a href=""http://twitter.com/download/iphone"" rel=""nofollow"">Twitter for iPhone</a>","TheJarlequin",0,FALSE,FALSE,NA,NA
"368","Thanks for brightening my day

Flu season may not have peaked, and there's another wave of severe infections underw… https://t.co/7ZTeeCpGZ1",FALSE,2,NA,2019-03-08 18:17:58,TRUE,NA,"1104083853055066113",NA,"<a href=""http://twitter.com/#!/download/ipad"" rel=""nofollow"">Twitter for iPad</a>","janrobinjackson",0,FALSE,FALSE,NA,NA
"369","Vintage 1900s Flu Cover Featuring Lady Holding A Fan Made In Germany https://t.co/dLR5CQSipl #Etsy #WisdomLane… https://t.co/CCvDTXMo4E",FALSE,0,NA,2019-03-08 18:17:57,TRUE,NA,"1104083850039361537",NA,"<a href=""http://www.twitter-fu.com"" rel=""nofollow"">twitter-fu</a>","Wisdom_Lane",0,FALSE,FALSE,NA,NA
"370","Tat man just canceled on me <U+0001F614><U+0001F629> niggas getting the flu n shit omg",FALSE,0,NA,2019-03-08 18:17:44,FALSE,NA,"1104083797866360832",NA,"<a href=""http://twitter.com/download/iphone"" rel=""nofollow"">Twitter for iPhone</a>","iznnae",0,FALSE,FALSE,NA,NA
"371","I'm not long for this world, the manz flu is growing ever stronger! Ive done a vid, it releases tomorrow.

Now I do… https://t.co/3mqg5dDKpE",FALSE,17,NA,2019-03-08 18:17:44,TRUE,NA,"1104083795148505089",NA,"<a href=""http://twitter.com"" rel=""nofollow"">Twitter Web Client</a>","TheRunningManZ",1,FALSE,FALSE,NA,NA
"372","Me, sick with a bad cold: I still have some energy. I’m fine. 

Me, sick with the flu: I am dead. I have died. Plea… https://t.co/PUpaXa6QcQ",FALSE,0,NA,2019-03-08 18:17:34,TRUE,NA,"1104083752106508290",NA,"<a href=""http://twitter.com/download/iphone"" rel=""nofollow"">Twitter for iPhone</a>","mykiepaige",0,FALSE,FALSE,NA,NA
"373","Day three of lent, and my body is going through an actual withdraw of sugar. I truly feel like I have the flu going… https://t.co/w0uOAa2vsH",FALSE,0,NA,2019-03-08 18:17:19,TRUE,NA,"1104083692325167105",NA,"<a href=""http://twitter.com/download/iphone"" rel=""nofollow"">Twitter for iPhone</a>","rachelelphick2",0,FALSE,FALSE,NA,NA
"374","Flu may have peaked, but experts eye jump in nastier strain:  https://t.co/B4Ojt2wnu2",FALSE,1,NA,2019-03-08 18:15:27,FALSE,NA,"1104083222428897281",NA,"<a href=""http://www.socialnewsdesk.com"" rel=""nofollow"">SocialNewsDesk</a>","kytv",1,FALSE,FALSE,NA,NA
"375","#Tamiflu (oseltamivir) is the most common ""treatment"" for #influenza, and a 2015 meta-analysis  found a 21% shorter… https://t.co/I53QBRnyDt",FALSE,0,NA,2019-03-08 18:15:01,TRUE,NA,"1104083113003618305",NA,"<a href=""https://www.semrush.com/"" rel=""nofollow"">SEMrush Social Media Tool</a>","EBmedicine",1,FALSE,FALSE,NA,NA
"376","@_chenaniah_ Steups it’s the stupid flu :/",FALSE,0,"_chenaniah_",2019-03-08 18:14:33,FALSE,"1104082753216278529","1104082996762693633","931859366","<a href=""http://twitter.com/download/iphone"" rel=""nofollow"">Twitter for iPhone</a>","lauragaravitom",0,FALSE,FALSE,NA,NA
"377","@ericbolling @komonews How many death by pain from pain induce heart spasms listed as an OD?How many is due to an a… https://t.co/ML6fQ10fmR",FALSE,2,"ericbolling",2019-03-08 18:13:23,TRUE,"1103436408302100481","1104082700829306880","14839147","<a href=""http://twitter.com/download/iphone"" rel=""nofollow"">Twitter for iPhone</a>","JaneStanley64",2,FALSE,FALSE,NA,NA
"378","New pill shows early promise for blocking many strains of flu https://t.co/c4VOzxif21",FALSE,1,NA,2019-03-08 18:13:18,FALSE,NA,"1104082679182573569",NA,"<a href=""http://twitter.com"" rel=""nofollow"">Twitter Web Client</a>","acolmone",0,FALSE,FALSE,NA,NA
"379","Flu may have peaked, but experts eye jump in nastier strain https://t.co/eiXSHtzpEg https://t.co/hzpfS69y4B",FALSE,0,NA,2019-03-08 18:12:59,FALSE,NA,"1104082599247572992",NA,"<a href=""http://publicize.wp.com/"" rel=""nofollow"">WordPress.com</a>","TopTrending18",0,FALSE,FALSE,NA,NA
"380","Flu season may not have peaked, and there's another wave of severe infections underway, CDC says - CNN… https://t.co/uT0WKhSCP6",FALSE,0,NA,2019-03-08 18:12:55,TRUE,NA,"1104082583720214528",NA,"<a href=""http://twibble.io"" rel=""nofollow"">Twibble.io</a>","rhotwire",0,FALSE,FALSE,NA,NA
"381","Flu Research Once Banned Because It Was Deemed Too Dangerous Is Set to Resume https://t.co/Hhn5cbCZdg",FALSE,0,NA,2019-03-08 18:12:15,FALSE,NA,"1104082415780274177",NA,"<a href=""https://ifttt.com"" rel=""nofollow"">IFTTT</a>","neuropuff",0,FALSE,FALSE,NA,NA
"382","I knew something was wrong with my kidneys. Ever since I got the flu.",FALSE,0,NA,2019-03-08 18:10:20,FALSE,NA,"1104081932311244800",NA,"<a href=""http://twitter.com/download/android"" rel=""nofollow"">Twitter for Android</a>","Dimpzssss",0,FALSE,FALSE,NA,NA
"383","Are you at a greater risk for a flu-related emergency? Learn more about how to spot the signs of when to go to your… https://t.co/Fsgg0iSkzT",FALSE,0,NA,2019-03-08 18:10:10,TRUE,NA,"1104081892368879620",NA,"<a href=""https://www.hootsuite.com"" rel=""nofollow"">Hootsuite Inc.</a>","NHPRIHealth",0,FALSE,FALSE,NA,NA
"384","@Wethepeoplehope My son had the flu this year, doc told me if he gets better, then worse, it may be bacterial. I'd… https://t.co/3hHd3miJ4g",FALSE,1,"Wethepeoplehope",2019-03-08 18:10:08,TRUE,"1104066943122882560","1104081883925762049","1047589722216980480","<a href=""http://twitter.com/download/android"" rel=""nofollow"">Twitter for Android</a>","dustin_ekos",0,FALSE,FALSE,NA,NA
"385","@CashApp $ROMAINECarter47",FALSE,0,"CashApp",2019-03-08 18:09:52,FALSE,"1104067352243654656","1104081815915118593","1445650784","<a href=""http://twitter.com/download/iphone"" rel=""nofollow"">Twitter for iPhone</a>","Flu_MuSICK",0,FALSE,FALSE,NA,NA
"386","Flu may have peaked, but experts eye jump in nastier strain https://t.co/3ICWMLmivW https://t.co/5cZq9xRGJE",FALSE,0,NA,2019-03-08 18:08:34,FALSE,NA,"1104081490239983618",NA,"<a href=""http://twibble.io"" rel=""nofollow"">Twibble.io</a>","WRDW_WAGT",0,FALSE,FALSE,NA,NA
"387","A new flu experiment targeted parts of the virus that appear in every strain, giving more hope for a universal flu… https://t.co/itxPSKOiJ1",FALSE,0,NA,2019-03-08 18:08:24,TRUE,NA,"1104081447156097024",NA,"<a href=""https://buffer.com"" rel=""nofollow"">Buffer</a>","PPHCanada",0,FALSE,FALSE,NA,NA
"388","I’ve been out of work since Wednesday with the flu, I haven’t left my bed. I’ve also been battling with a lot of An… https://t.co/0Ajoe4WKEw",FALSE,1,NA,2019-03-08 18:08:03,TRUE,NA,"1104081357888720901",NA,"<a href=""http://twitter.com/download/iphone"" rel=""nofollow"">Twitter for iPhone</a>","mskaylaalee27",0,FALSE,FALSE,NA,NA
"389","@rayjusso Hah. Too much for me was one bad bet on soccer and one ML that didn't work out. I've won it all back righ… https://t.co/SiRFt5UakR",FALSE,0,"rayjusso",2019-03-08 18:08:02,TRUE,"1104074040044601346","1104081353174331394","1034745421875306497","<a href=""http://twitter.com/download/android"" rel=""nofollow"">Twitter for Android</a>","MemphisCapper",0,FALSE,FALSE,NA,NA
"390","@ScooterMcgilli1 stomach virus and flu like symptoms are just the placefiller injury designation in sports",FALSE,0,"ScooterMcgilli1",2019-03-08 18:08:00,FALSE,"1104080474669047808","1104081346807382017","1047475842736185344","<a href=""http://twitter.com/download/android"" rel=""nofollow"">Twitter for Android</a>","Danny_ZUK0",0,FALSE,FALSE,NA,NA
"391","Type A Influenza SUCKS!
that is all.....",FALSE,0,NA,2019-03-08 18:07:48,FALSE,NA,"1104081297016643584",NA,"<a href=""http://www.facebook.com/twitter"" rel=""nofollow"">Facebook</a>","NancyLamWraps",0,FALSE,FALSE,NA,NA
"392","Ain’t no better way to kick off the weekend like getting diagnosed with the flu <U+0001F912>",FALSE,1,NA,2019-03-08 18:07:14,FALSE,NA,"1104081154116935680",NA,"<a href=""http://twitter.com/download/iphone"" rel=""nofollow"">Twitter for iPhone</a>","LiveLoveSheaf",0,FALSE,FALSE,NA,NA
"393","US Government lifts ban to allow 'dangerous' bird flu experiments https://t.co/dATGDgJ1yl via @MailOnline",FALSE,0,NA,2019-03-08 18:06:55,FALSE,NA,"1104081075477848071",NA,"<a href=""http://twitter.com"" rel=""nofollow"">Twitter Web Client</a>","Canyoucanicanwe",0,FALSE,FALSE,NA,NA
"394","@TheresaDees3 @psychdr100 He's an eye Dr doubt he knows wth he's talking about on vaccines and research though I do… https://t.co/m78fUVrBBe",FALSE,0,"TheresaDees3",2019-03-08 18:06:52,TRUE,"1104072941363437568","1104081060294471681","2598987210","<a href=""http://twitter.com/download/android"" rel=""nofollow"">Twitter for Android</a>","LisaMcintosh403",0,FALSE,FALSE,NA,NA
"395","@TheJarlequin @amyklobuchar @SenMarkey @SenTinaSmith The technology is there, but we're still really ""nibbling at t… https://t.co/GIqkY1jTRS",FALSE,0,"TheJarlequin",2019-03-08 18:06:46,TRUE,"1103094344309985280","1104081036965789696","995030871651602440","<a href=""https://about.twitter.com/products/tweetdeck"" rel=""nofollow"">TweetDeck</a>","PublicHealthUMN",0,FALSE,FALSE,NA,NA
"396","@ScottPresler Regrettably I cannot make it this weekend <U+0001F625><U+0001F62A> I have contracted the flu from my dad... I'm sorry and I… https://t.co/K7y1pIhYvL",FALSE,2,"ScottPresler",2019-03-08 18:05:57,TRUE,"1104072023712718849","1104080828601192449","931286316","<a href=""http://twitter.com/download/android"" rel=""nofollow"">Twitter for Android</a>","RealJamespelkey",0,FALSE,FALSE,NA,NA
"397","Stupid flu.. i avoided you for a year... why now.. leave me alone... i enjoy my sleep. And ability to eat solids.. https://t.co/xOjHs9E5yJ",FALSE,0,NA,2019-03-08 18:05:42,FALSE,NA,"1104080766928007169",NA,"<a href=""http://twitter.com/download/android"" rel=""nofollow"">Twitter for Android</a>","Love_Alix17",0,FALSE,FALSE,NA,NA
"398","Unrepaired congenital heart disease kid with bronchiolitis about to be discharged after a short stay:-
Me “ mom she… https://t.co/kFigWg9ebJ",FALSE,1,NA,2019-03-08 18:04:55,TRUE,NA,"1104080568613068801",NA,"<a href=""http://twitter.com/download/iphone"" rel=""nofollow"">Twitter for iPhone</a>","kamat_pradip",0,FALSE,FALSE,NA,NA
"399","An Antibody-Inspired Small Molecule Could Make For A Better Flu Treatment https://t.co/yhabUCHliv",FALSE,0,NA,2019-03-08 18:04:31,FALSE,NA,"1104080469807767552",NA,"<a href=""http://www.facebook.com/twitter"" rel=""nofollow"">Facebook</a>","HeatherHealth",0,FALSE,FALSE,NA,NA
"400","What a week of seminars at @UWMadisonMMI! First @LangloisLab gave a great talk abt unexpected outcomes of flu infec… https://t.co/03idh92JV8",FALSE,7,NA,2019-03-08 18:04:29,TRUE,NA,"1104080461171748864",NA,"<a href=""http://twitter.com/download/iphone"" rel=""nofollow"">Twitter for iPhone</a>","BakerVirusMaker",2,FALSE,FALSE,NA,NA
"401","@MichelleBruton When you have the flu its acceptable to put whiskey in your morning coffee",FALSE,0,"MichelleBruton",2019-03-08 18:04:06,FALSE,"1103801325505138688","1104080365285597184","24738810","<a href=""http://twitter.com/download/android"" rel=""nofollow"">Twitter for Android</a>","rinaldopurisimo",0,FALSE,FALSE,NA,NA
"402","Flu Research Once Banned Because It Was Deemed Too Dangerous Is Set to Resume
L: https://t.co/jIXJh4LGhz
C: https://t.co/y4jCbN72ou",FALSE,1,NA,2019-03-08 18:03:26,FALSE,NA,"1104080196527972352",NA,"<a href=""http://hnfp.c17r.com"" rel=""nofollow"">HN Front Page</a>","hn_frontpage",0,FALSE,FALSE,NA,NA
"403","There's a second wave of severe flu infections happening, CDC says - CNN https://t.co/5fPmjXUswN",FALSE,0,NA,2019-03-08 18:03:03,FALSE,NA,"1104080102155927552",NA,"<a href=""https://dlvrit.com/"" rel=""nofollow"">dlvr.it</a>","3rdrockhome",0,FALSE,FALSE,NA,NA
"404","We want to celebrate the many women who lead research for #lunghealth. Dr. Seema Lakdawala is researching how indoo… https://t.co/IzFt5WZfC1",FALSE,2,NA,2019-03-08 18:03:03,TRUE,NA,"1104080100952338432",NA,"<a href=""https://sproutsocial.com"" rel=""nofollow"">Sprout Social</a>","LungAssociation",2,FALSE,FALSE,NA,NA
"405","Flu season may not have peaked, and there's another wave of severe infections underway, CDC says - CNN https://t.co/RpU3gSQZ6X",FALSE,0,NA,2019-03-08 18:02:58,FALSE,NA,"1104080081822142464",NA,"<a href=""http://twitter.com/download/iphone"" rel=""nofollow"">Twitter for iPhone</a>","RicardoRiveraNJ",0,FALSE,FALSE,NA,NA
"406","I have the flu for the first time and let me tell you...I’m dying",FALSE,0,NA,2019-03-08 18:02:28,FALSE,NA,"1104079954814386176",NA,"<a href=""http://twitter.com/download/iphone"" rel=""nofollow"">Twitter for iPhone</a>","morganmiller0",0,FALSE,FALSE,NA,NA
"407","This is shaping up to be a really interesting day - time to book you places https://t.co/ZH8QIdRwF4 https://t.co/ESKir94J88",FALSE,0,NA,2019-03-08 18:02:10,FALSE,NA,"1104079880155742208",NA,"<a href=""http://twitter.com"" rel=""nofollow"">Twitter Web Client</a>","uniworchistory",0,FALSE,FALSE,NA,NA
