"","text","favorited","favoriteCount","replyToSN","created","truncated","replyToSID","id","replyToUID","statusSource","screenName","retweetCount","isRetweet","retweeted","longitude","latitude"
"246","Argh! Flu bug, I am so done with you. (Sadly, it seems flu bug is not done with me yet. <U+0001F912><U+0001F634>) #takingiteasy… https://t.co/axUY2kWZDT",FALSE,1,NA,2019-03-08 18:57:33,TRUE,NA,"1104093815671939073",NA,"<a href=""http://twitter.com/download/iphone"" rel=""nofollow"">Twitter for iPhone</a>","angielofthouse",0,FALSE,FALSE,NA,NA
"247","We have suffered a couple injuries on the trip as well as some flu victims. Excited to see how some other guys step… https://t.co/oCN0uTjPom",FALSE,6,NA,2019-03-08 18:57:25,TRUE,NA,"1104093781681307648",NA,"<a href=""http://twitter.com/download/android"" rel=""nofollow"">Twitter for Android</a>","CliffBaseball",0,FALSE,FALSE,NA,NA
"248","How can you tell if its the flu or a cold? People often mistake a common cold for the flu and vice versa. Dr. Micha… https://t.co/x6DMqUYvkP",FALSE,0,NA,2019-03-08 18:57:14,TRUE,NA,"1104093738052272128",NA,"<a href=""http://www.hubspot.com/"" rel=""nofollow"">HubSpot</a>","LakeHealth",0,FALSE,FALSE,NA,NA
"249","The Journal of @WPI recorded in its class notes that Wyman died 12/1918 ""of influenza, in London, where she had bee… https://t.co/HIRENGXQT4",FALSE,0,"Worcester_Aud",2019-03-08 18:57:03,TRUE,"1104093687645130752","1104093688450465792","1064630164783595521","<a href=""http://twitter.com"" rel=""nofollow"">Twitter Web Client</a>","Worcester_Aud",1,FALSE,FALSE,NA,NA
"250","The William Ward Genealogy states that Norcross died 10/1918 at Camp Dix in #NJ: ""During the World War she held the… https://t.co/eqgfN4WK2o",FALSE,0,"Worcester_Aud",2019-03-08 18:57:02,TRUE,"1104093682167365632","1104093687645130752","1064630164783595521","<a href=""http://twitter.com"" rel=""nofollow"">Twitter Web Client</a>","Worcester_Aud",0,FALSE,FALSE,NA,NA
"251","People get rightly upset about antivaxxers, but around half of us don't get the annual flu vax either! https://t.co/rUptmvqgNa",FALSE,2,NA,2019-03-08 18:56:28,FALSE,NA,"1104093544388706304",NA,"<a href=""http://twitter.com"" rel=""nofollow"">Twitter Web Client</a>","EdCara4",0,FALSE,FALSE,NA,NA
"252","@Tim77349156 It's funny; RN here- I do not and will not take flu, Pnemonia, Shingles, or any other vaccines. I'm fl… https://t.co/64PcfxGruO",FALSE,0,"Tim77349156",2019-03-08 18:56:23,TRUE,"1100113725363634176","1104093523371016194","1066469945754537985","<a href=""http://twitter.com/download/iphone"" rel=""nofollow"">Twitter for iPhone</a>","melissa37227778",0,FALSE,FALSE,NA,NA
"253","Flu may have peaked, but experts eye jump in nastier strain https://t.co/YmVK7ANUbg #NBC15 https://t.co/ouIRBFbyZ8",FALSE,0,NA,2019-03-08 18:56:12,FALSE,NA,"1104093475379789825",NA,"<a href=""http://www.socialnewsdesk.com"" rel=""nofollow"">SocialNewsDesk</a>","nbc15_madison",0,FALSE,FALSE,NA,NA
"254","Is this the Disease X that the globalist keep hyping? US government approves experiment to create a type of bird fl… https://t.co/IAhG2zcjsI",FALSE,1,NA,2019-03-08 18:55:42,TRUE,NA,"1104093348674109441",NA,"<a href=""http://twitter.com"" rel=""nofollow"">Twitter Web Client</a>","RaptormanReport",0,FALSE,FALSE,NA,NA
"255","Kentucky Reporting ""Widespread"" Flu Activity https://t.co/sg4VANw4Za https://t.co/QDdjJs72QP",FALSE,0,NA,2019-03-08 18:55:35,FALSE,NA,"1104093321662816256",NA,"<a href=""http://wordpressforbroadcasters.com"" rel=""nofollow"">WPB Social Connect</a>","whvoradio",0,FALSE,FALSE,NA,NA
"256","I’ve concluded it’s either food poisoning or the stomach flu. What did I do to deserve this<U+0001F62D><U+0001F62D><U+0001F62D> https://t.co/SkHCDOyHgY",FALSE,0,NA,2019-03-08 18:54:47,FALSE,NA,"1104093120805986305",NA,"<a href=""http://twitter.com/download/iphone"" rel=""nofollow"">Twitter for iPhone</a>","m3gn0g",0,FALSE,FALSE,NA,NA
"257","Kentucky Reporting ""Widespread"" Flu Activity https://t.co/ytZx6nuKUF https://t.co/0cXCw7Sjmw",FALSE,0,NA,2019-03-08 18:54:45,FALSE,NA,"1104093110936719366",NA,"<a href=""http://wordpressforbroadcasters.com"" rel=""nofollow"">WPB Social Connect</a>","WKDZ",0,FALSE,FALSE,NA,NA
"258","@crkjelstrom We just split wards right when she was born, so I don't know anyone in our ward well enough. :( I put… https://t.co/gDzdMiflRS",FALSE,0,"crkjelstrom",2019-03-08 18:54:30,TRUE,"1104081525094711302","1104093046927351810","893905933633441792","<a href=""https://mobile.twitter.com"" rel=""nofollow"">Twitter Web App</a>","sugarpoultry",0,FALSE,FALSE,NA,NA
"259","everybody wanna have the flu. not me girl. no ma’am. https://t.co/HXI5b42HYd",FALSE,3,NA,2019-03-08 18:54:28,FALSE,NA,"1104093038954139648",NA,"<a href=""http://twitter.com/download/iphone"" rel=""nofollow"">Twitter for iPhone</a>","fonzfranc",1,FALSE,FALSE,NA,NA
"260","Been sick with the flu all week and miserable. Gigi has not left my side-silly lil girl! #flusucks… https://t.co/v05TeNBLDT",FALSE,0,NA,2019-03-08 18:53:52,TRUE,NA,"1104092890886737920",NA,"<a href=""http://twitter.com/download/iphone"" rel=""nofollow"">Twitter for iPhone</a>","GundSand",0,FALSE,FALSE,NA,NA
"261","@BUNNYH00D Don’t take flu shots yo. They poisonous",FALSE,0,"BUNNYH00D",2019-03-08 18:53:52,FALSE,"1099699519678238720","1104092889330663424","999296773301600257","<a href=""http://twitter.com/download/iphone"" rel=""nofollow"">Twitter for iPhone</a>","maine30001",0,FALSE,FALSE,NA,NA
"262","The flu has caused up to 26.3M illnesses, 347K hospitalizations and 31K deaths so far this season, @CDCFlu reports… https://t.co/cyQxjQDY9z",FALSE,3,NA,2019-03-08 18:53:29,TRUE,NA,"1104092794224664577",NA,"<a href=""http://twitter.com"" rel=""nofollow"">Twitter Web Client</a>","PublicHealth",6,FALSE,FALSE,NA,NA
"263","I just got a 0 on an assignment that was worth 50% of my grade so far just cuz I couldn’t turn it in in person cuz I have the flu <U+0001F643>",FALSE,2,NA,2019-03-08 18:53:25,FALSE,NA,"1104092776193511424",NA,"<a href=""http://twitter.com/download/iphone"" rel=""nofollow"">Twitter for iPhone</a>","alexsears97",0,FALSE,FALSE,NA,NA
"264","Salt Lake City News Flu season may not have peaked, and there's another wave of severe infections underway, CDC say… https://t.co/Qf0dBpc6zF",FALSE,0,NA,2019-03-08 18:53:06,TRUE,NA,"1104092696547749888",NA,"<a href=""https://dlvrit.com/"" rel=""nofollow"">dlvr.it</a>","SaltLakeCity_NC",0,FALSE,FALSE,NA,NA
"265","Indy News Flu season may not have peaked, and there's another wave of severe infections underway, CDC says - CNN… https://t.co/S2b5C09GPG",FALSE,0,NA,2019-03-08 18:53:06,TRUE,NA,"1104092695230701568",NA,"<a href=""https://dlvrit.com/"" rel=""nofollow"">dlvr.it</a>","Indianapolis_NC",0,FALSE,FALSE,NA,NA
"266","Atlanta News Flu season may not have peaked, and there's another wave of severe infections underway, CDC says - CNN… https://t.co/tkoEhJxFM1",FALSE,0,NA,2019-03-08 18:53:05,TRUE,NA,"1104092691275513856",NA,"<a href=""https://dlvrit.com/"" rel=""nofollow"">dlvr.it</a>","Atlanta_NC",0,FALSE,FALSE,NA,NA
"267","Columbus News Flu season may not have peaked, and there's another wave of severe infections underway, CDC says - CN… https://t.co/C8K89IryYB",FALSE,0,NA,2019-03-08 18:53:05,TRUE,NA,"1104092690197577728",NA,"<a href=""https://dlvrit.com/"" rel=""nofollow"">dlvr.it</a>","Columbus_NC",0,FALSE,FALSE,NA,NA
"268","The chance of your child having autism is 79% higher if you fight an illness such as the flu during pregnancy. In o… https://t.co/0EzF78hc7n",FALSE,0,NA,2019-03-08 18:52:45,TRUE,NA,"1104092607662178308",NA,"<a href=""http://twitter.com/download/iphone"" rel=""nofollow"">Twitter for iPhone</a>","Chris_calimano",0,FALSE,FALSE,NA,NA
"269","The flu shot can be self diagnosed and self treated when first found, but never be scared to go to a professional.",FALSE,0,NA,2019-03-08 18:51:38,FALSE,NA,"1104092328833306624",NA,"<a href=""https://mobile.twitter.com"" rel=""nofollow"">Twitter Web App</a>","Matheus55736400",0,FALSE,FALSE,NA,NA
"270","The flu can be prevented by taking the flu shot! Get your today.",FALSE,0,NA,2019-03-08 18:50:44,FALSE,NA,"1104092101346758657",NA,"<a href=""https://mobile.twitter.com"" rel=""nofollow"">Twitter Web App</a>","Matheus55736400",0,FALSE,FALSE,NA,NA
"271","In bed with the stomach flu on this #InternationalWomensDay but and still grateful to all the queens in my life. https://t.co/CTu9H5KfAW",FALSE,3,NA,2019-03-08 18:50:24,FALSE,NA,"1104092016655458307",NA,"<a href=""http://twitter.com/download/iphone"" rel=""nofollow"">Twitter for iPhone</a>","annetaylor",0,FALSE,FALSE,NA,NA
"272","I literally only have one leg shaved because I was too dizzy to keep standing in the shower, and my job is still go… https://t.co/HBfgMiu9oj",FALSE,1,NA,2019-03-08 18:49:54,TRUE,NA,"1104091889651859456",NA,"<a href=""http://twitter.com/download/iphone"" rel=""nofollow"">Twitter for iPhone</a>","tarakelm",0,FALSE,FALSE,NA,NA
"273","In the US alone 3 million cases of the flu occur every year",FALSE,0,NA,2019-03-08 18:49:49,FALSE,NA,"1104091870433628160",NA,"<a href=""https://mobile.twitter.com"" rel=""nofollow"">Twitter Web App</a>","Matheus55736400",0,FALSE,FALSE,NA,NA
"274","Update ECDC/WHO - Influenza activity was widespread in the European Region in week 9 - Influenza type A virus detec… https://t.co/W9LmkzqZNF",FALSE,0,NA,2019-03-08 18:49:10,TRUE,NA,"1104091706553704448",NA,"<a href=""http://twitter.com"" rel=""nofollow"">Twitter Web Client</a>","GertvanderHoek",0,FALSE,FALSE,NA,NA
"275","A small-molecule fusion inhibitor of influenza virus is orally active in mice – Science Magazine… https://t.co/HDJnwJ4mmN",FALSE,0,NA,2019-03-08 18:48:43,TRUE,NA,"1104091591835152384",NA,"<a href=""http://publicize.wp.com/"" rel=""nofollow"">WordPress.com</a>","WorldWeeklyNew2",0,FALSE,FALSE,NA,NA
"276","New Approach To Flu Treatment Mimics Antibodies : Shots – Health News – NPR https://t.co/2RN9vfFun2 https://t.co/CYKWkFfRQK",FALSE,0,NA,2019-03-08 18:48:18,FALSE,NA,"1104091487606841345",NA,"<a href=""http://publicize.wp.com/"" rel=""nofollow"">WordPress.com</a>","WorldWeeklyNew2",0,FALSE,FALSE,NA,NA
"277","US Government lifts ban to allow 'dangerous' bird flu experiments https://t.co/EQUJsXkuc0 via @MailOnline",FALSE,0,NA,2019-03-08 18:48:01,FALSE,NA,"1104091415204818949",NA,"<a href=""http://twitter.com/download/android"" rel=""nofollow"">Twitter for Android</a>","IndieArtSouth",0,FALSE,FALSE,NA,NA
"278","@CJPendragon @SeekingSomeone @zmax87 @TSaurusBecks International Men's Day occurs any time a guy gets the flu... I… https://t.co/IyL5E2onQF",FALSE,1,"CJPendragon",2019-03-08 18:47:56,TRUE,"1104087350710288390","1104091397844549633","705681300","<a href=""http://twitter.com/download/android"" rel=""nofollow"">Twitter for Android</a>","Prophetx15",0,FALSE,FALSE,NA,NA
"279","The episode of @parksandrecnbc when Leslie has the flu is absolutely one of my favs https://t.co/EJfeHc2OIc",FALSE,3,NA,2019-03-08 18:47:46,FALSE,NA,"1104091354374832129",NA,"<a href=""http://twitter.com/download/iphone"" rel=""nofollow"">Twitter for iPhone</a>","therachelmayo",0,FALSE,FALSE,NA,NA
"280","Dear @Gaughran4Senate it was a pleasure to attend yesterday’s Town Hall, I hope you reconsider your stance on SB299… https://t.co/5i6SULitqO",FALSE,2,NA,2019-03-08 18:47:07,TRUE,NA,"1104091189156945925",NA,"<a href=""http://twitter.com/download/iphone"" rel=""nofollow"">Twitter for iPhone</a>","NICUBatman",0,FALSE,FALSE,NA,NA
"281","Flu season isn’t over just yet. Taking precautions will be key to keeping students healthy all year round:… https://t.co/URp4Dx7jK0",FALSE,0,NA,2019-03-08 18:46:55,TRUE,NA,"1104091140930846723",NA,"<a href=""http://twitter.com"" rel=""nofollow"">Twitter Web Client</a>","LearningTechz",0,FALSE,FALSE,NA,NA
"282","pray for brandy y’all.. she has the flu right now.",FALSE,0,NA,2019-03-08 18:46:11,FALSE,NA,"1104090954473054209",NA,"<a href=""http://twitter.com/download/iphone"" rel=""nofollow"">Twitter for iPhone</a>","_emahuerta",0,FALSE,FALSE,NA,NA
"283","Join the fight today against the flu! Take the shot and you will be <U+0001F4AF> spread the word today!",FALSE,0,NA,2019-03-08 18:46:03,FALSE,NA,"1104090923326193665",NA,"<a href=""https://mobile.twitter.com"" rel=""nofollow"">Twitter Web App</a>","Matheus55736400",0,FALSE,FALSE,NA,NA
"284","The flu is different from a cold. Find out the differences in symptoms, who is at risk, and warning signs in childr… https://t.co/qJpuHPdPaZ",FALSE,0,NA,2019-03-08 18:45:34,TRUE,NA,"1104090798851796993",NA,"<a href=""http://www.facebook.com/twitter"" rel=""nofollow"">Facebook</a>","myinsplus",0,FALSE,FALSE,NA,NA
"285","Flu death toll climbs to 119 in NC, claims life of first child 4 or younger https://t.co/Nb22IjizOt https://t.co/v5Lf0qMJO1",FALSE,2,NA,2019-03-08 18:45:00,FALSE,NA,"1104090656845123584",NA,"<a href=""https://studio.twitter.com"" rel=""nofollow"">Twitter Media Studio</a>","WLOS_13",0,FALSE,FALSE,NA,NA
"286","I’m for most/logical vaccines (measles, smallpox, etc), but is it possible that we’ve gone vaccine crazy?  Maybe th… https://t.co/WB1a3MDYHr",FALSE,0,NA,2019-03-08 18:44:22,TRUE,NA,"1104090498321518592",NA,"<a href=""http://twitter.com/download/iphone"" rel=""nofollow"">Twitter for iPhone</a>","bgr8t2469",0,FALSE,FALSE,NA,NA
"287","Please help my son walk again! 3 years ago my son had a flu vaccine. Shortly after he was paralyzed and left him qu… https://t.co/LZtglVAbsp",FALSE,6,NA,2019-03-08 18:44:07,TRUE,NA,"1104090433653637120",NA,"<a href=""http://twitter.com"" rel=""nofollow"">Twitter Web Client</a>","AnnaEloyan1",9,FALSE,FALSE,NA,NA
"288","Mom - Flu&gt;Want More Parents To Vaccinate? This Is What Truly Helps:T- https://t.co/bpWjwla1GY #baby https://t.co/T8165h4M0w",FALSE,0,NA,2019-03-08 18:44:04,FALSE,NA,"1104090424841592834",NA,"<a href=""http://www.veryinternationalpeople.com"" rel=""nofollow"">LifeStyleVIP_US</a>","BabyMDoctor",0,FALSE,FALSE,NA,NA
"289","@muncyman_22 Maybe a flu or something personal? It’s weird to think he would be left off the 18 for no reason",FALSE,0,"muncyman_22",2019-03-08 18:44:02,FALSE,"1104089649880985602","1104090415479906304","965376207431913472","<a href=""http://twitter.com/download/iphone"" rel=""nofollow"">Twitter for iPhone</a>","Chrisawesome63",0,FALSE,FALSE,NA,NA
"290","Tennessee horses returning from out-of-state events test positive for equine influenza https://t.co/fmqyz2qffv",FALSE,0,NA,2019-03-08 18:43:25,FALSE,NA,"1104090261179764738",NA,"<a href=""http://twitter.com"" rel=""nofollow"">Twitter Web Client</a>","NC5",3,FALSE,FALSE,NA,NA
"291","I thought bronchitis/Up Resp. Infection, tonsillitis, &amp; strep throat was enough sickness for this year. But I guess… https://t.co/DxwSxk5Wqz",FALSE,0,NA,2019-03-08 18:42:47,TRUE,NA,"1104090100873478145",NA,"<a href=""http://twitter.com/download/iphone"" rel=""nofollow"">Twitter for iPhone</a>","kyleeantoinette",0,FALSE,FALSE,NA,NA
"292","Capsulated bacteria
“Some Bacteria Have An Effective Paste Surrounding Membrane Yielding Pseudo Fort, Bypassing Kil… https://t.co/JrUEGY28ru",FALSE,0,NA,2019-03-08 18:42:27,TRUE,NA,"1104090014093201409",NA,"<a href=""http://twittbot.net/"" rel=""nofollow"">twittbot.net</a>","master_usmle_rv",0,FALSE,FALSE,NA,NA
"293","Flu season continues with a second wave of severe flu infections happening, CDC says -  https://t.co/BJ94gp0R19",FALSE,0,NA,2019-03-08 18:42:01,FALSE,NA,"1104089908598042625",NA,"<a href=""http://twitter.com/download/iphone"" rel=""nofollow"">Twitter for iPhone</a>","IdaFlo",0,FALSE,FALSE,NA,NA
"294","US Government lifts ban to allow 'dangerous' bird flu experiments https://t.co/WRjDEQV8KB via @MailOnline",FALSE,0,NA,2019-03-08 18:41:03,FALSE,NA,"1104089662203793409",NA,"<a href=""http://twitter.com"" rel=""nofollow"">Twitter Web Client</a>","Carolinetelesc1",0,FALSE,FALSE,NA,NA
"295","The flu is about to get me boys.
If i die before the season starts I’m haunting all of you. Hella pissed.",FALSE,16,NA,2019-03-08 18:39:48,FALSE,NA,"1104089347463233543",NA,"<a href=""http://twitter.com/download/iphone"" rel=""nofollow"">Twitter for iPhone</a>","KcHolz",0,FALSE,FALSE,NA,NA
"296","@ZachariahBASSan I have the flu and a sinus infection and I decided not to go to a show because of it. It’ll make you feel worse :(",FALSE,0,"ZachariahBASSan",2019-03-08 18:39:44,FALSE,"1104037272566071297","1104089332481048576","1007068213006528512","<a href=""http://twitter.com/download/iphone"" rel=""nofollow"">Twitter for iPhone</a>","EilishRivas",0,FALSE,FALSE,NA,NA
"297","@iyshieeboo She has the flu <U+0001F62D>",FALSE,0,"iyshieeboo",2019-03-08 18:39:21,FALSE,"1104085245924585472","1104089236544741376","1048936268","<a href=""http://twitter.com/download/iphone"" rel=""nofollow"">Twitter for iPhone</a>","BreeeMarie__",0,FALSE,FALSE,NA,NA
"298","@SwankykongTV As soon as I'm getting back 100% again! Second flu in 2 weeks!",FALSE,1,"SwankykongTV",2019-03-08 18:39:16,FALSE,"1104087302060548099","1104089215355273222","1063108373544079360","<a href=""http://twitter.com/download/android"" rel=""nofollow"">Twitter for Android</a>","thmeye",0,FALSE,FALSE,NA,NA
"299","Kid #1 positive for Flu A....
You know what that means..... https://t.co/FeBAA1zVZ8",FALSE,1,NA,2019-03-08 18:39:02,FALSE,NA,"1104089154672095239",NA,"<a href=""http://twitter.com/download/android"" rel=""nofollow"">Twitter for Android</a>","natashajasso",0,FALSE,FALSE,NA,NA
"300","Bronchitis, sinus infection, double ear infection. Boo.

But yay to no Influenza!",FALSE,0,NA,2019-03-08 18:38:44,FALSE,NA,"1104089080583897089",NA,"<a href=""http://www.facebook.com/twitter"" rel=""nofollow"">Facebook</a>","klynn75",0,FALSE,FALSE,NA,NA
"301","This horrible flu going around is far from over . They expect a second strain to hit in every state except for Alas… https://t.co/aJLAyldcrY",FALSE,0,NA,2019-03-08 18:37:22,TRUE,NA,"1104088737393205249",NA,"<a href=""http://twitter.com/download/iphone"" rel=""nofollow"">Twitter for iPhone</a>","Msmere7Parker",0,FALSE,FALSE,NA,NA
"302","Equine flu remains a concern as new cases confirmed https://t.co/6ZFfXGzYxY https://t.co/EdZOOxhyiK",FALSE,0,NA,2019-03-08 18:37:04,FALSE,NA,"1104088662881513475",NA,"<a href=""https://ifttt.com"" rel=""nofollow"">IFTTT</a>","HyndsightEquine",0,FALSE,FALSE,NA,NA
"303","Yo estoy entre esos 347,000: There were as many as 26.3 million flu illnesses, 12.4 million medical visits and 347,… https://t.co/MzRu832toA",FALSE,1,NA,2019-03-08 18:36:14,TRUE,NA,"1104088450687475712",NA,"<a href=""http://twitter.com/#!/download/ipad"" rel=""nofollow"">Twitter for iPad</a>","nnguerrero",0,FALSE,FALSE,NA,NA
"304","Flu season may not have peaked, and there's another wave of severe infections underway, CDC says - CNN https://t.co/Sk0SkEwKzQ",FALSE,0,NA,2019-03-08 18:35:34,FALSE,NA,"1104088284064559106",NA,"<a href=""http://twitter.com/download/iphone"" rel=""nofollow"">Twitter for iPhone</a>","lvekcsmiles",0,FALSE,FALSE,NA,NA
"305","Been sick with influenza a all week and all I want is some ocharleys potato soup and rolls",FALSE,0,NA,2019-03-08 18:35:24,FALSE,NA,"1104088243010789376",NA,"<a href=""http://twitter.com/download/iphone"" rel=""nofollow"">Twitter for iPhone</a>","laurenkink98",0,FALSE,FALSE,NA,NA
"306","@CouRageJD I’m sick with the flu and I need a good stream to watch all day!",FALSE,0,"Rocket_Monkey26",2019-03-08 18:35:21,FALSE,"1104088082691829766","1104088228095766528","860962832254369794","<a href=""http://twitter.com/download/iphone"" rel=""nofollow"">Twitter for iPhone</a>","Rocket_Monkey26",0,FALSE,FALSE,NA,NA
"307","Everyone you know is sick right now. So the question is, is it too late to get a flu shot? https://t.co/vxclnno2d0",FALSE,10,NA,2019-03-08 18:34:42,FALSE,NA,"1104088066736693249",NA,"<a href=""http://www.socialflow.com"" rel=""nofollow"">SocialFlow</a>","InStyle",1,FALSE,FALSE,NA,NA
"308","Second day of flu for youngest. Hoping the rest of us are spared.",FALSE,3,NA,2019-03-08 18:34:11,FALSE,NA,"1104087935014617091",NA,"<a href=""http://twitter.com/download/iphone"" rel=""nofollow"">Twitter for iPhone</a>","palmd",0,FALSE,FALSE,NA,NA
"309","Do you need your flu shots but you don’t know if it’s covered by your insurance? Edwards Pharmacy can help by revie… https://t.co/vK5Cj4zyWT",FALSE,0,NA,2019-03-08 18:33:47,TRUE,NA,"1104087834154143749",NA,"<a href=""https://omgnational.com/"" rel=""nofollow"">UNI Social Posting</a>","EdwardsPharmacy",0,FALSE,FALSE,NA,NA
"310","Day 4 of being miserably sick, so off to the doctor this morning. Congratulations! It’s Type A Flu for me. Bad news, it’s too late to treat.",FALSE,0,NA,2019-03-08 18:33:38,FALSE,NA,"1104087795453308930",NA,"<a href=""http://tapbots.com/tweetbot"" rel=""nofollow"">Tweetbot for i<U+039F>S</a>","DATman65",0,FALSE,FALSE,NA,NA
"311","It’s important to understand that flu symptoms can vary from child to child, and they can change as the illness pro… https://t.co/QWiIgRtjuT",FALSE,0,NA,2019-03-08 18:32:46,TRUE,NA,"1104087580247654400",NA,"<a href=""https://www.thryv.com/"" rel=""nofollow"">Thryv</a>","CCPED_ROCHESTER",0,FALSE,FALSE,NA,NA
"312","If your child has cold or flu symptoms with a fever, talk to your doctor about giving him or her children’s acetami… https://t.co/lPlQIhGsB0",FALSE,0,NA,2019-03-08 18:32:46,TRUE,NA,"1104087578947383296",NA,"<a href=""https://www.thryv.com/"" rel=""nofollow"">Thryv</a>","CCPED_ROCHESTER",0,FALSE,FALSE,NA,NA
"313","My 11-year-old who is home w/ flu but feeling better: “Can I clean your pots and pans?!” Wow, girlfriend, you sure… https://t.co/ROBRNrSqoG",FALSE,20,NA,2019-03-08 18:32:45,TRUE,NA,"1104087574472200194",NA,"<a href=""http://twitter.com/download/iphone"" rel=""nofollow"">Twitter for iPhone</a>","fionaleslie",0,FALSE,FALSE,NA,NA
"314","can we talk about how fucking useless tamiflu is? you have to take it on the first day of flu symptoms (which is st… https://t.co/TS2SAX2nRe",FALSE,0,NA,2019-03-08 18:32:35,TRUE,NA,"1104087534588608512",NA,"<a href=""http://twitter.com"" rel=""nofollow"">Twitter Web Client</a>","INeedABroom",0,FALSE,FALSE,NA,NA
"315","even when i live on my own, my mama still takes care of me while i have the flu. she just showed up with chicken noodle soup and sprite<U+0001F629><U+0001F629><U+0001F62D><U+0001F62D>",FALSE,1,NA,2019-03-08 18:32:12,FALSE,NA,"1104087438702579712",NA,"<a href=""http://twitter.com/download/iphone"" rel=""nofollow"">Twitter for iPhone</a>","kayla_skyberg",0,FALSE,FALSE,NA,NA
"316","US Government lifts ban to allow 'dangerous' bird flu experiments https://t.co/qlXbIm5COd via @MailOnline",FALSE,0,NA,2019-03-08 18:32:03,FALSE,NA,"1104087399401955329",NA,"<a href=""http://twitter.com"" rel=""nofollow"">Twitter Web Client</a>","WBooneHedgepeth",0,FALSE,FALSE,NA,NA
"317","Flu season may not have peaked, and there's another wave of severe infections underway, CDC says - CNN https://t.co/8rGIQVPDxU",FALSE,0,NA,2019-03-08 18:31:35,FALSE,NA,"1104087280225058823",NA,"<a href=""http://twitter.com/download/iphone"" rel=""nofollow"">Twitter for iPhone</a>","mturner15",0,FALSE,FALSE,NA,NA
"318","Flu season may not have peaked, and there's another wave of severe infections underway, CDC says - CNN https://t.co/CP3jRBAdVw",FALSE,0,NA,2019-03-08 18:31:20,FALSE,NA,"1104087219806052352",NA,"<a href=""http://twitter.com/download/iphone"" rel=""nofollow"">Twitter for iPhone</a>","BestSportsState",0,FALSE,FALSE,NA,NA
"319","What are you doing to protect yourself from the flu? https://t.co/23Yeuy8xRp",FALSE,0,NA,2019-03-08 18:31:18,FALSE,NA,"1104087211023257601",NA,"<a href=""http://www.socialnewsdesk.com"" rel=""nofollow"">SocialNewsDesk</a>","WPSDLocal6",2,FALSE,FALSE,NA,NA
"320","Flu season may not have peaked, and there's another wave of severe infections underway, CDC says - CNN https://t.co/tPbLxKmsSB",FALSE,0,NA,2019-03-08 18:31:00,FALSE,NA,"1104087133474689025",NA,"<a href=""http://twitter.com/download/iphone"" rel=""nofollow"">Twitter for iPhone</a>","bmangh",0,FALSE,FALSE,NA,NA
"321","@AdamSchein I showed this to my kids who have the flu and now they’re fully recovered. https://t.co/pyo1Wgsjg5",FALSE,3,"AdamSchein",2019-03-08 18:30:41,FALSE,"1104010710676373505","1104087055879987200","37824341","<a href=""http://twitter.com/download/iphone"" rel=""nofollow"">Twitter for iPhone</a>","realprinceblue",0,FALSE,FALSE,NA,NA
"322","‘Widespread’ flu activity reported for tenth week in Kentucky https://t.co/FpdLgBbrej",FALSE,0,NA,2019-03-08 18:30:32,FALSE,NA,"1104087017598734336",NA,"<a href=""http://www.facebook.com/twitter"" rel=""nofollow"">Facebook</a>","hopkinsville",0,FALSE,FALSE,NA,NA
"323","3 MORE FLU DEATHS IN CT: The total number of deaths caused by the flu in Connecticut has hit 40 after three more fa… https://t.co/Y3JxIEen0M",FALSE,0,NA,2019-03-08 18:30:27,TRUE,NA,"1104086996086083585",NA,"<a href=""https://panel.socialpilot.co/"" rel=""nofollow"">SocialPilot.co</a>","JusticeLawCT",0,FALSE,FALSE,NA,NA
"324","Flu season may not have peaked, and there's another wave of severe infections underway, CDC says - CNN https://t.co/rJ8vGjAwcz",FALSE,0,NA,2019-03-08 18:30:25,FALSE,NA,"1104086988754481155",NA,"<a href=""http://twitter.com/download/iphone"" rel=""nofollow"">Twitter for iPhone</a>","maxinecook",0,FALSE,FALSE,NA,NA
"325","It's #flu season ... how clean are your hands? Thanks to @MeriwetherLES kids &amp; teachers who welcomed @UVASON for a… https://t.co/SxXp2sYl3h",FALSE,13,NA,2019-03-08 18:30:25,TRUE,NA,"1104086988368547841",NA,"<a href=""http://twitter.com"" rel=""nofollow"">Twitter Web Client</a>","UVASON",4,FALSE,FALSE,NA,NA
"326","New pill shows early promise for blocking many strains of flu
https://t.co/llDsZPicu3",FALSE,0,NA,2019-03-08 18:30:23,FALSE,NA,"1104086978298085377",NA,"<a href=""http://twitter.com"" rel=""nofollow"">Twitter Web Client</a>","innovatellc",0,FALSE,FALSE,NA,NA
